{
  "kind": "endpoint-assessment",
  "contractVersion": "2.0.0",
  "id": "synthetic/pio-like/assessment-line1-temp",
  "version": "1.0.0",
  "body": {
    "snapshotRef": {
      "kind": "interpretation-snapshot",
      "id": "synthetic/pio-like/snapshot",
      "version": "1.0.0",
      "digest": "8da4a51645761e01196c43c13562a51c311e2a72f23d660073fb9e8d25d4ee96"
    },
    "endpoint": {
      "nodeId": "n.line1-temp"
    },
    "closure": {
      "nodeIds": [
        "n.line1-temp",
        "n.plc1"
      ],
      "edgeIds": [
        "e.temp-source"
      ],
      "completeness": "complete",
      "basis": "the only reference is resolved and no unresolved item touches these nodes"
    },
    "axes": {
      "capture": {
        "status": "partial",
        "basis": "the snapshot's own coverage is partial",
        "blockers": []
      },
      "structure": {
        "status": "complete",
        "basis": "address, scale and unit are all read; the reference is resolved",
        "blockers": []
      },
      "representation": {
        "status": "representable",
        "basis": "a source definition with a linear scale expresses it",
        "blockers": []
      },
      "virtualEquivalence": {
        "status": "passed-within-scope",
        "basis": "synthetic/line1-temp-scale, one input",
        "blockers": []
      },
      "meaning": {
        "status": "reviewer-confirmed",
        "basis": "decision-1 and decision-3",
        "blockers": []
      },
      "approval": {
        "status": "not-submitted",
        "basis": "nothing has been sent to Bifrost",
        "blockers": []
      }
    },
    "decisionRefs": [
      {
        "kind": "review-decision",
        "id": "synthetic/pio-like/decision-1",
        "version": "1.0.0",
        "digest": "1e3f72bf17a51a5cfca1535d6e690fc1ec1fb6f9d4538bd4a7be9b6281ab1ebf"
      },
      {
        "kind": "review-decision",
        "id": "synthetic/pio-like/decision-3",
        "version": "1.0.0",
        "digest": "75e21591e997f0c3f348790c2a17e5211e4e154d733454d817528baece56c739"
      }
    ],
    "assessedAt": "2026-10-22T00:03:00Z"
  },
  "digest": "973a8b25d81a51222f39759e35d56f1a4e5b012233558dc277ec5632865456f5"
}
