{
  "kind": "endpoint-assessment",
  "contractVersion": "2.0.0",
  "id": "synthetic/closure-c/assessment-chain",
  "version": "1.0.0",
  "body": {
    "snapshotRef": {
      "kind": "interpretation-snapshot",
      "id": "synthetic/closure-c/snapshot",
      "version": "1.0.0",
      "digest": "20cb5ba6c9283548ae39ecbdfa738e95edfd77ba86479390bda4db8528558d3b"
    },
    "endpoint": {
      "nodeId": "n.c-chain"
    },
    "closure": {
      "nodeIds": [
        "n.c-chain",
        "n.c-plc",
        "n.c-raw",
        "n.c-script",
        "n.c-total"
      ],
      "edgeIds": [
        "e.chain-script",
        "e.chain-total",
        "e.raw-plc",
        "e.script-raw",
        "e.total-raw"
      ],
      "completeness": "complete",
      "basis": "the source reference is missing (u.count-source)"
    },
    "axes": {
      "capture": {
        "status": "partial",
        "basis": "the snapshot's own coverage is partial",
        "blockers": []
      },
      "structure": {
        "status": "partial",
        "basis": "the source connection is not in the bundle",
        "blockers": [
          "connection plc2 missing"
        ]
      },
      "representation": {
        "status": "conditional",
        "basis": "depends on what plc2 turns out to be",
        "blockers": []
      },
      "virtualEquivalence": {
        "status": "not-tested",
        "basis": "no input can be fixed without the source",
        "blockers": []
      },
      "meaning": {
        "status": "unconfirmed",
        "basis": "decision-2 asks for more evidence",
        "blockers": []
      },
      "approval": {
        "status": "not-submitted",
        "basis": "nothing has been sent to Bifrost",
        "blockers": []
      }
    },
    "decisionRefs": [
      {
        "kind": "review-decision",
        "id": "synthetic/closure-c/decision-4",
        "version": "1.0.0",
        "digest": "b28c561568106ad13f0f30fb9a78b05978d6ffbcf24604b540e89abe986728a7"
      }
    ],
    "assessedAt": "2026-10-22T00:04:00Z"
  },
  "digest": "dd5df544b2ffbac3cf401ecedd773414eba0e214c39b9d217b374715bdff1bd0"
}
